Porduct Page URL,Catégorie,Title,Product Description,Review out of 5,UPC,Product Type,Price (excl. tax),Price (incl. tax),Tax,Availability,Number of reviews
https://books.toscrape.com/catalogue/online-marketing-for-busy-authors-a-step-by-step-guide_913/index.html,Self Help,Online Marketing for Busy Authors: A Step-By-Step Guide,"If You Want People to Read Your Book, Writing It Is Only the Beginning There has truly never been a better time to be an author. For the first time, authors have direct access to the public via the Internet and can create a community eagerly awaiting their book. But where do new authors start? How do they sort through the dizzying range of online options? Where should they If You Want People to Read Your Book, Writing It Is Only the Beginning There has truly never been a better time to be an author. For the first time, authors have direct access to the public via the Internet and can create a community eagerly awaiting their book. But where do new authors start? How do they sort through the dizzying range of online options? Where should they spend their time online and what should they be doing? Enter Fauzia Burke, a digital book marketing pioneer and friend of overwhelmed writers everywhere. She takes authors step-by-step through the process of identifying their unique personal brand, defining their audience, clarifying their aspirations and goals, and setting priorities. She offers advice on designing a successful website, building a mailing list of superfans, blogging, creating an engagement strategy for social media, and more. By following Burke's expert advice, authors can conquer the Internet and still get their next manuscript in on time. "" ...more",1,9ffa38d3b832433a,Books,£46.35,£46.35,£0.00,In stock (16 available),0
https://books.toscrape.com/catalogue/how-to-be-miserable-40-strategies-you-already-use_897/index.html,Self Help,How to Be Miserable: 40 Strategies You Already Use,"In How to Be Miserable, psychologist Randy Paterson outlines 40 specific behaviors and habits, which—if followed—are sure to lead to a lifetime of unhappiness. On the other hand, if you do the opposite, you may yet join the ranks of happy people everywhere!There are stacks upon stacks of self-help books that will promise you love, happiness, and a fabulous life. But how ca In How to Be Miserable, psychologist Randy Paterson outlines 40 specific behaviors and habits, which—if followed—are sure to lead to a lifetime of unhappiness. On the other hand, if you do the opposite, you may yet join the ranks of happy people everywhere!There are stacks upon stacks of self-help books that will promise you love, happiness, and a fabulous life. But how can you pinpoint the exact behaviors that cause you to be miserable in the first place? Sometimes when we’re depressed, or just sad or unhappy, our instincts tell us to do the opposite of what we should—such as focusing on the negative, dwelling on what we can’t change, isolating ourselves from friends and loved ones, eating junk food, or overindulging in alcohol. Sound familiar?This tongue-in-cheek guide will help you identify the behaviors that make you unhappy and discover how you—and only you—are holding yourself back from a life of contentment. You’ll learn to spot the tried-and-true traps that increase feelings of dissatisfaction, foster a lack of motivation, and detract from our quality of life—as well as ways to avoid them.So, get ready to live the life you want (or not?) This fun, irreverent guide will light the way. ...more",1,a6f99b9e687f9d46,Books,£46.03,£46.03,£0.00,In stock (16 available),0
https://books.toscrape.com/catalogue/overload-how-to-unplug-unwind-and-unleash-yourself-from-the-pressure-of-stress_725/index.html,Self Help,"Overload: How to Unplug, Unwind, and Unleash Yourself from the Pressure of Stress","#1 New York Times bestselling author Joyce Meyer shows readers how to become free from the burden of stress so that they can achieve God's best for their lives. As technology increases your accessibility, it becomes harder to mute the background noise of your life and receive God's guidance. Joyce Meyer calls this OVERLOAD, when the demands of your busy life become all-con #1 New York Times bestselling author Joyce Meyer shows readers how to become free from the burden of stress so that they can achieve God's best for their lives. As technology increases your accessibility, it becomes harder to mute the background noise of your life and receive God's guidance. Joyce Meyer calls this OVERLOAD, when the demands of your busy life become all-consuming and overwhelming. But to experience the joyful life God has planned, you must make time to focus on His Word. Then you'll receive His healing calmness and gain the strength to take on life's challenges, from physical ailments to problems in relationships. Through the practical advice and Scriptural wisdom in this book, you'll learn how to unplug and free yourself from burdens that weigh you down. You'll gain simple, effective tips for better rest and stress management and discover the fulfilling life you were meant to lead. ...more",3,8ecf0356a3878811,Books,£52.15,£52.15,£0.00,In stock (14 available),0
https://books.toscrape.com/catalogue/you-are-a-badass-how-to-stop-doubting-your-greatness-and-start-living-an-awesome-life_508/index.html,Self Help,You Are a Badass: How to Stop Doubting Your Greatness and Start Living an Awesome Life,"Bestselling author, speaker, and success coach Jen Sincero cuts through the din of the self-help genre with her own verbal meat cleaver. Full of blunt humor, sage advice, and the occasional swear word, You are a Badass offers its readers new opportunities for growth through 35 chapters of exercises, suggestions, and hilariously inspiring stories.From ""Fear is for Suckers"" Bestselling author, speaker, and success coach Jen Sincero cuts through the din of the self-help genre with her own verbal meat cleaver. Full of blunt humor, sage advice, and the occasional swear word, You are a Badass offers its readers new opportunities for growth through 35 chapters of exercises, suggestions, and hilariously inspiring stories.From ""Fear is for Suckers"" to ""Your Brain is Your Bitch"" these chapters provide enlightening lessons: How to stop doubting your greatness, how to love what you don't love about yourself, and how to tap into source energy to live a bigger life than you've ever imagined. ...more",3,88ec621893e595d0,Books,£12.08,£12.08,£0.00,In stock (7 available),0
https://books.toscrape.com/catalogue/how-to-stop-worrying-and-start-living_431/index.html,Self Help,How to Stop Worrying and Start Living,"Learn how to break the worry habit -- Now and forever! With Dale Carnegie's timeless advice in hand, more than six million people have learned how to eliminate debilitating fear and worry from their lives and to embrace a worry-free future. In this classic work, How to Stop Worrying and Start Living, Carnegie offers a set of practical formulas that you can put to work tod Learn how to break the worry habit -- Now and forever! With Dale Carnegie's timeless advice in hand, more than six million people have learned how to eliminate debilitating fear and worry from their lives and to embrace a worry-free future. In this classic work, How to Stop Worrying and Start Living, Carnegie offers a set of practical formulas that you can put to work today. It is a book packed with lessons that will last a lifetime and make that lifetime happier! DISCOVER HOW TO: Eliminate fifty percent of business worries immediatelyReduce financial worriesAvoid fatigue -- and keep looking youngAdd one hour a day to your waking lifeFind yourself and be yourself -- remember there is no one else on earth like you! Fascinating to read and easy to apply, How to Stop Worrying and Start Living deals with fundamental emotions and life-changing ideas. There's no need to live with worry and anxiety that keep you from enjoying a full, active life! ...more",5,e792c0969cefe1b8,Books,£46.49,£46.49,£0.00,In stock (6 available),0
